id,type,text,answer_type,answer,reply_true,reply_false,partial_min,partial_max,reply_partial,suggest
1,simple,Какова общая высота памятника?,int,15,"Верно! Общая высота памятника 15.7 метров. Высота пьедестала — 6 м; высота фигур — 3,3 м; креста на державе — 3 м","Не угадали! Общая высота памятника 15.7 метров. Высота пьедестала — 6 м; высота фигур — 3,3 м; креста на державе — 3 м",,,,"10;12;15"
2,simple,"Сколько поэтов, стихотворения которых изучают в школе, изображны на памятнике?",int,6,"Верно. Всего шесть: Михаил Ломоносов, Гавриил Державин, Иван Крылов, Василий Жуковский, Михаил Лермонтов, Александр Пушкин, Их шесть, посмотреть на них можно в нижнем ярусе в разделе Писателей и композиторов (это группа мужчин в камзолах и сюртуках).  Нас интересуют Ломоносов, Гариила Державин, баснописец Крылов, автор романтических баллад Жуковский, Михаил Лерманов и Александр Пушкин. ","Их шесть, посмотреть на них можно в нижнем ярусе в разделе Писателей и композиторов (это группа мужчин в камзолах и сюртуках).  Нас интересуют Ломоносов, Гариила Державин, баснописец Крылов, автор романтических баллад Жуковский, Михаил Лерманов и Александр Пушкин. ",,,,"2;4;6"
3,attention,Сколько фигур между Пушкиным и князем Владимиром Красно Солнышко?,int,7,"Верно! А если считать фигуры в обратную сторону по всему нижнему ярусу, получится ровно 100, если конечно я не ошиблась.","Фигуры Пушкина и князя Владимира Красно Солнышко находятся в нижнем ярусе памятника. Пушкин в плаще стоит в середине группы писателей и художников, между Лермонтовым и Гоголем. Князь Владимир 4-й в соседней группе Просветителей, он стоит с крестом в правой руке и указывает левой на крестильную чашу. Между ними 7 фигур.",5,8,"Немного не угадал, давай вместе обойдем памятник и посчитаем. Пушкин в плаще стоит в середине группы писателей и художников, между Лермонтовым и Гоголем. От Пушкина пойдем налево. Гоголь -1, Михаил Глинка - 2, Карл Брюлов - 3, композитор Боротнянский -4. Начинается раздел Просветителей, и мыпродолжаем счет. Братья Кирилл и Мефодий сидят с книгой - это 5 и 6, княгиня Ольга у них за спиной -7. Итого 7 фигур"
4,attention,"Некоторые персоны изображены на памятнике дважды, например, князь Владимир, крестивший Россию. Сколько всего исторических деятелей изображены дважды?",int,7,"Верно! На самом деле таких персон довольно много. Кроме князя Владимира одновременно и в среднем, и в нижнем ярусе встречаются Дмитрий Донской и Иван Третий, а еще родоначальник династии Михаил Романов вместе с гражданином Мининым и князем Пожарским. И конечно Петр Первый. Итого семеро.","На самом деле таких персон довольно много. Кроме князя Владимира одновременно и в среднем, и в нижнем ярусе встречаются Дмитрий Донской и Иван Третий, а еще родоначальник династии Михаил Романов вместе с гражданином Мининым и князем Пожарским. И конечно Петр Первый. Итого семеро.",,,
5,hard,"Знаешь ли ты, что за тысячилетнюю историю Английского королевства в нем сменилось более десяти правящих династий. А сколько правящих династий было в России за тысячу?",int,3,"Верно. Династии Рюриковичей, Годуновых и Романовых","В истории России было 3 династии - Рюриковичи, Годуновы и Романовы.",,,
6,simple,"При правлении какого императора был возвигнут этот памятник?",str,"Александр","Верно!","На самом деле во время правления Александра второго",,,,
